TYPE,DIST,LICNO,SS,ADR,INFO,EXPDATE,LPS_Id
KE,18,5418800028,Garden 51,"24/F., CODA PLAZA, 51 GARDEN ROAD, CENTRAL, HONG KONG",,2019-09-06,0
KE,18,5418800037,Garden 51,"23/F., CODA PLAZA, 51 GARDEN ROAD, CENTRAL, HONG KONG",,2018-04-12,0
KE,52,4452800108,BIG ECHO I-BOX,"G/F, ENTRANCE & 1/F, PEACE TOWER, NO. 6 PEACE AVENUE, KOWLOON",,2017-11-21,0
KE,52,5452800055,Neway Karaoke Box,"SHOPS 6-7 AND 1/F, PRINCE RITZ, 440-450 PRINCE EDWARD ROAD WEST, KOWLOON CITY, KOWLOON",,2019-10-06,0
KE,62,5462800021,Neway Karaoke Box,"SHOP NO. 505, LEVEL 5, MOKO, 193 PRINCE EDWARD ROAD WEST, MONG KOK, KOWLOON",,2018-07-06,0
KE,62,5462800100,Jackpot Night Club,"1/F, MEE CHEONG BUILDING, 141, 143& 145 PORTLAND STREET, KOWLOON",,2019-02-04,0
KE,62,5462800119,Neway Karaoke Box,"11/F & 12/F, CHONG HING SQUARE, 593-601 NATHAN ROAD, MONG KOK, KOWLOON",,2019-03-05,0
KE,62,5462800137,NEW BRILLIANT KARAOKE NIGHT CLUB,"4/F, SUN HING BUILDING, 607 NATHAN ROAD, MONG KOK, KOWLOON",,2018-08-16,0
KE,62,5462800146,金麗宮卡拉OK夜總會,"2/F, 7 CHANG SHA STREET, MONG KOK, KOWLOON",,2018-11-14,0
KE,62,5462800164,ASIA & CENTURY KARAOKE NIGHT CLUB,"6/F TO 7/F, SUN HING BUILDING, 607 NATHAN ROAD, MONG KOK, KOWLOON",,2017-11-03,0
KE,62,5462800173,NEW CITY KARAOKE NIGHT CLUB,"224 (G/F) & 208-228 (1/F), TONG MI ROAD, TAI KOK TSUI, MONG KOK, KOWLOON",,2018-05-22,0
KE,62,5462800182,Red Mr. Ktv,"SHOP OR NON-DOMESTIC PREMISES ON 3/F & 4/F, FAR EAST BANK MONGKOK BUILDING, 11 NELSON STREET, MONG KOK, KOWLOON",,2019-01-09,0
KE,62,5462800191,RED MR,"PORTION 3A OF SHOP OR NON-DOMESTIC PREMISES ON 3/F, FAR EAST BANK MONGKOK BUILDING, 11 NELSON STREET, KOWLOON",,2018-02-06,0
KE,62,5462800207,NEW A GOLDEN ROSE KARAOKE NIGHT CLUB,"2/F, MANLY COMMERCIAL BLDG, 11-17 SOY STREET, MONG KOK, KOWLOON",,2019-09-26,0
KE,61,4461800636,GOLD LAI SHING,"1/F, 497-497A NATHAN ROAD, YAU MA TEI, KOWLOON",,2018-03-28,0
KE,61,5461000040,Neway Karaoke Box,"PTN A, B, C1 & C2, 1ST BASEMENT, AUTO PLAZA, 65 MODY ROAD, TSIM SHA TSUI EAST, KOWLOON",,2018-12-15,0
KE,61,5461000059,CLUB CRYSTALLITIC,"SHOP NOS. B201-B210, B211-B216 & B232-B235, 2ND BASEMENT, REGAL KOWLOON HOTEL, 71 MODY ROAD, TSIM SHA TSUI, KOWLOON",,2019-01-19,0
KE,61,5461000110,Hanabi,"SHOP NO. 1-3, UG/F, ENERGY PLAZA, 92 GRANVILLE ROAD, TSIM SHA TSUI EAST, KOWLOON",,2019-06-27,0
KE,61,5461000174,Vision,"1/F, CAMBRIDGE HOUSE, 26-28 CAMERON ROAD, TSIM SHA TSUI, KOWLOON",,2017-11-28,0
KE,61,5461000183,CHOCOLATE,"1/F, CHINACHEM CAMERON CENTRE, 42-44 CAMERON ROAD, TSIM SHA TSUI, KOWLOON",,2017-12-05,0
KE,61,5461800060,MUSE,"3/F, GOLDEN DRAGON CENTRE, 38-40 CAMERON ROAD, TSIM SHA TSUI, KOWLOON",,2018-07-02,0
KE,61,5461800088,NOBLE,"3/F, PODIUM PLAZA, 5-7B HANOI ROAD, TSIM SHA TSUI, KOWLOON",,2018-09-19,0
KE,61,5461800112,Club Star,"UNIT 1, 2, 13-15, 3/F, HOUSTON CENTRE, 63 MODY ROAD, KOWLOON",,2019-04-02,0
KE,61,5461800121,玉寶酒廊,"SHOP 2-6, 1/F, HARBOUR CRYSTAL CENTRE, 100 GRANVILLE ROAD, TSIM SHA TSUI, KOWLOON",,2019-07-26,0
KE,61,5461800176,Y. B II,"SHOP 16-19, 1/F, HARBOUR CRYSTAL CENTRE, 100 GRANVILLE ROAD, TSIM SHA TSUI, KOWLOON",,2017-12-18,0
KE,61,5461800185,舞臺,"SHOPS B1, B3 & B4, 2/F, NEW MANDARIN PLAZA, 14 SCIENCE MUSEUM ROAD, TSIM SHA TSUI, KOWLOON",,2018-01-10,0
KE,61,5461800194,SECRET,"SHOP 8-10, BASEMENT 1, ENERGY PLAZA, 92 GRANVILLE ROAD, TSIM SHA TSUI EAST, KOWLOON",,2018-01-14,0
KE,61,5461800219,Club De Hong Kong,"3/F (NORTH EAST PORTION), TSIMSHATSUI CENTRE, 66 MODY ROAD, TSIM SHA TSUI, KOWLOON",,2018-04-07,0
KE,61,5461800246,VINEYARD KARAOKE NIGHT CLUB,"1/F, 6-6C NANKING STREET, JORDAN, KOWLOON",,2018-07-20,0
KE,61,5461800291,NEW STAR & RIVER NIGHT CLUB,"2/F, WOON LEE COMMERCIAL BUILDING, 7-9 AUSTIN AVENUE, TSIM SHA TSUI, KOWLOON",,2018-10-08,0
KE,61,5461800343,BUCKINGHAM BALLROOM,"7/F., BUCKINGHAM BUILDING, 317-321 NATHAN ROAD, JORDAN, KOWLOON",,2017-12-13,0
KE,61,5461800361,NEW FAIR LADY NIGHT CLUB,"BASEMENT, WOON LEE COMMERCIAL BUILDING, 7-9 AUSTIN AVENUE, TSIM SHA TSUI, KOWLOON",,2018-02-02,0
KE,61,5461800389,NEW YORK KARAOKE NIGHT CLUB,"4/F, POLLOCK BUILDING, 9-10 TAK HING STREET, KOWLOON",,2018-02-09,0
KE,61,5461800398,JADE CITY KARAOKE NIGHT CLUB,"4/F, 317-321 NATHAN ROAD, JORDAN, KOWLOON",,2018-02-09,0
KE,61,5461800413,AV NIGHT CLUB,"3/F, WOON LEE COMMERCIAL BUILDING, 7-9 AUSTIN AVENUE, TSIM SHA TSUI, KOWLOON",,2018-06-03,0
KE,61,5461800422,ALLOY KARAOKE LOUNGE,"UNIT 1 TO 4, 3/F, HART AVENUE PLAZA, 5-9A HART AVENUE, TSIM SHA TSUI, KOWLOON",,2018-09-12,0
KE,61,5461800431,Toronto,"UNITS 7-9, LG/F, ENERGY PLAZA, 92 GRANVILLE ROAD, TSIM SHA TSUI EAST, KOWLOON",,2019-04-19,0
KE,61,5461800440,L & G KARAOKE NIGHT CLUB,"SHOP L (G/F), 1/F, BUCKINGHAM BUILDING, 317-321 NATHAN ROAD, JORDAN, KOWLOON",,2019-05-23,0
KE,61,5461800468,ORIENTAL NIGHT CLUB,"3/F, BUCKINGHAM BUILDING, 317-321 NATHAN ROAD, JORDAN, KOWLOON",,2019-07-20,0
KE,61,5461800477,JAPAN CITY KARAOKE NIGHT CLUB,"5/F, BUCKINGHAM BUILDING, 317-321 NATHAN ROAD, KOWLOON",,2019-07-26,0
KE,61,5461800486,Red Mr. Ktv,"1/F & 2/F, BCC BUILDING, 25-31 CARNARVON ROAD, TSIM SHA TSUI, KOWLOON",,2019-08-18,0
KE,61,5461800495,Club Talent,"3/F, CAMBRIDGE HOUSE, 26-28 CAMERON ROAD, TSIM SHA TSUI, KOWLOON",,2017-10-13,0
KE,61,5461800510,Place To Go Night Club,"2/F, 2-6 NANKING STREET & 86-90 PARKES STREET, KOWLOON",,2017-11-30,0
KE,61,5461800529,CLUB A PLUS,"2/F, GOLDEN DRAGON CENTRE, 38-40 CAMERON ROAD, TSIM SHA TSUI, KOWLOON",,2018-05-08,0
KE,61,5461800565,HOLLYWOOD NIGHT CLUB,"3/F, BOOMAN HOUSE, NO. 37U JORDAN ROAD, KOWLOON",,2019-03-17,0
KE,61,5461800574,Club De Marquis,"PORTION OF G/F, CINEMA 3-5 & UG2/F, CHINACHEM GOLDEN PLAZA, 77 MODY ROAD, TSIM SHA TSUI EAST, KOWLOON",,2019-08-04,0
KE,61,5461800617,PROSPERITY KARAOKE,"UNIT B1 & UNIT B2, 3/F, TSIMSHATSUI CENTRE, 66 MODY ROAD, TSIMSHATSUI EAST, KOWLOON",,2018-01-09,0
KE,61,5461800626,NEW INTERNATIONAL NIGHT CLUB,"1/F, WAI WAH COMMERCIAL BUILDING, 109-113 PORTLAND STREET, KOWLOON",,2018-08-05,0
KE,61,5461800635,Uno 2,"SHOP NOS. B217-B223, REGAL KOWLOON HOTEL, 71 MODY ROAD, TSIM SHA TSUI EAST, KOWLOON",,2018-10-28,0
KE,61,5461800644,MUSICBOX,"10/F, 10 PRAT, 10 PRAT AVENUE, TSIM SHA TSUI, KOWLOON",,2019-01-11,0
KE,61,5461800662,BABY ONE,"SHOP NO. C1, 33-45, UG/F, SOUTH SEAS CENTRE, 75 MODY ROAD, TSIM SHA TSUI, KOWLOON",,2018-03-15,0
KE,61,5461800671,NABI,"UNIT 1, 3/F, MULTIFIELD PLAZA, 3-7 PRAT AVENUE, TSIM SHA TSUI, KOWLOON",,2019-01-15,0
KE,61,5461800680,UNO,"SHOP 225, 2ND BASEMENT, REGAL KOWLOON HOTEL, 71 MODY ROAD, TSIM SHA TSUI, KOWLOON",,2019-09-27,0
KE,12,5412800071,Goshen,"9/F, FIRST COMMERCIAL BUILDING , 33-35 LEIGHTON ROAD , CAUSEWAY BAY, HONG KONG",,2019-08-02,0
KE,12,5412800150,FACES,"SHOP NO. 302, 3/F., SHOPPING ARCADE, CONVENTION PLAZA, 1 HARBOUR ROAD, WANCHAI, HONG KONG",,2018-09-17,0
KE,12,5412800220,Fook Lam Restaurant,"28/F., 205-211 JOHNSTON ROAD, WAN CHAI, HONG KONG",,2018-09-27,0
KE,12,5412800248,VEGAS,"27/F., 205-211 JOHNSTON ROAD, WAN CHAI, HONG KONG",,2018-10-21,0
KE,12,5412800257,Red Mr. Ktv,"8/F., WINDSOR HOUSE, 311 GLOUCESTER ROAD, CAUSEWAY BAY, HONG KONG",,2019-07-06,0
KE,12,5412800336,Neway Karaoke Box,"3/F(PORTION) AND THE WHOLE OF 4/F, EMPEROR GROUP CENTRE, 288 HENNESSY ROAD, WAN CHAI, HONG KONG",,2018-03-24,0
KE,12,5412800354,K FIVE CLUB,"5/F., KUO HWA BUILDING, NO. 340-342 HENNESSY ROAD, WAN CHAI, HONG KONG",,2018-06-16,0
KE,12,5412800363,Number 8,"7/F., OLIV, 15-21 SHARP STREET EAST, CAUSEWAY BAY, HONG KONG",,2018-08-08,0
KE,12,5412800372,Neway Karaoke Box,"2/F.-3/F., LOK SING CENTRE, 19-31 YEE WO STREET, CAUSEWAY BAY, HONG KONG",,2019-08-23,0
KE,51,5451000010,Neway Karaoke Box,"L11-2, APM MILLENNIUM CITY 5, 418 KWUN TONG ROAD, KWUN TONG, KOWLOON",,2019-05-17,0
KE,51,5451800030,Red Mr. Ktv,"12 & 15/F, ONE PACIFIC CENTRE, 414 KWUN TONG ROAD, KOWLOON",,2019-08-01,0
PC,18,5013000036,PALACE IFC,"UPPER PART OF G/F(PORTION) AND G/F(PORTION), IFC MALL, 8 FINANCE STREET, CENTRAL, HONG KONG",,2018-06-24,0
PC,18,5018800024,AMC Pacific Place,"PORTION OF LEVEL 1 AND LEVEL 2, PACIFIC PLACE, ISLAND LOT 8571, 88 QUEENSWAY, HONG KONG",,2017-12-06,0
PC,18,5018800033,The Miller Theatre,"ASIA SOCIETY HONG KONG CENTER, MAGAZINE B, JUSTICE DRIVE, ADMIRALTY, INLAND LOT NO. 9000, HONG KONG",,2018-11-23,0
PC,18,5018800042,Auditorium at Chong Yuet Ming Cultural Centre,"4/F (PORTION), 5/F (PORTION) & 6/F (PORTION), CHONG YUET MING CULTURAL CENTRE, THE UNIVERSITY OF HONG KONG, POKFULAM ROAD, HONG KONG",,2018-06-15,0
PC,18,5718800030,EMPEROR CINEMAS,"PORTION OF 1/F, PORTION OF 2/F, MAJOR PORTION OF 3/F & MAJOR PORTION OF 4/F., ENTERTAINMENT BUILDING, 30 QUEEN'S ROAD CENTRAL, CENTRAL, HONG KONG",,2018-03-28,0
PC,52,5052000022,LUX THEATRE,"G/F (PORTION) TO 3/F (PORTION), 2J BULKELY STREET, HUNGHOM, KOWLOON CITY, KOWLOON",,2017-12-15,0
PC,52,5052000031,GH WHAMPOA,"PORTION OF G/F, 1/F & 2/F, WHAMPOA PLAZA, WHAMPOA GARDEN, 7 TAK ON STREET, HUNGHOM, KOWLOON CITY, KOWLOON",,2018-06-10,0
PC,94,5094000019,Yuen Long Theatre,"YUEN LONG THEATRE, DD 120, LOT 3678, YUEN LONG, NEW TERRITORIES",,2018-01-17,0
PC,94,5094000046,Broadway Kingswood Ginza,"SHOP NO.57 (G/F)  OF G/F., SHOP NO.138 (1/F)  OF 2/F, PHASE II, KINGSWOOD GINZA, TSWTL 4, 18 TIN YAN ROAD, YUEN LONG, NEW TERRITORIES",,2018-04-22,0
PC,94,5794800027,(No Record Found),"PORTION OF SHOP 1021 ON LEVEL 1, PORTION OF M/F AND PORTION OF G/F, YOHO MALL I, 9 LONG YAT ROAD, YUEN LONG, NEW TERRITORIES",,2018-01-16,0
PC,96,5096800024,GH FANLING,"SHOP 8 & 9, LEVEL 1, FANLING TOWN CENTRE, 18 FANLING STATION ROAD, FANLING, NEW TERRITORIES",,2018-01-15,0
PC,96,5096800033,MCL Green Code Cinema,"SHOP NO. G12 (CINEMA PORTION), GROUND FLOOR, GREEN CODE PLAZA, 1 MA SIK ROAD, FANLING, NEW TERRITORIES",,2018-07-09,0
PC,15,5015000058,Broadway Cyberport,"L1(PORTION) & L2(PORTION), CYBERCENTRE, 8969, CYBERPORT, POKFULAM, SOUTHERN, HONG KONG",,2017-12-15,0
PC,15,5015800023,Wellcome Theatre,"THEATRE, G/F WELLCOME THEATRE, THE BETHANIE, THE HONG KONG ACADEMY FOR PERFORMING ARTS, 139 POKFULAM ROAD, HONG KONG",,2018-03-06,0
PC,15,5015800032,MCL South Horizons Cinema,"4/F.,(PORTION) AND 5/F., (PORTION), EAST COMMERCIAL BLOCK, 18A SOUTH HORIZONS DRIVE, AP LEI CHAU, HONG KONG",,2018-09-20,0
PC,93,5093000012,Hyland Theatre,"G/F(PORTION), 1/F(PORTION) AND 2/F(PORTION), TMTL 281, HEUNG SZE WUI ROAD, TUEN MUN, NEW TERRITORIES",,2018-09-04,0
PC,93,5093000030,"Tuen Mun Paris London New York Milano Cinema 1, 2, 3 &4","TUEN MUN PARIS LONDON  NEW YORK MILANO CINEMA1, 2, 3,4, HONG LAI GARDEN, HO PONG STREET, TMTL 280, TUEN MUN, NEW TERRITORIES",,2018-07-03,0
PC,93,5093800023,UA TUEN MUN,"SHOP NO. 3201 (MAJOR PORTION), 3/F AND 4/F (PORTION), TUEN MUN TOWN PLAZA PHASE 1, T.M.T.L. 209, TUEN MUN, NEW TERRITORIES",,2018-06-11,0
PC,62,5062020072,"Broadway Theatre 1,2, 3, 4 & 5","G/F-3/F(PORTION) & 4/F-10/F, 6-12 SAI YEUNG CHOI STREET, KOWLOON",,2018-09-10,0
PC,62,5062020197,The Sky,"C1-C6 ON 1/F AND  PORTION OF (G/F, M/F, UG/F,P/F), OLYMPIAN CITY 2, 18 HOI TING ROAD, KOWLOON",,2017-11-12,0
PC,62,5062020461,Dynasty Theatre 1 & 2,"PORTION OF G/F & 1/F, 2/F & 3/F - 6/F &PORTION OF ROOF, DYNASTY PLAZA, 4-4A MONG KOK ROAD, KOWLOON",,2018-03-04,0
PC,62,5062020498,Cinema City (Langham Place) Limited,"PORTIONS OF (L1,L2,L3,L4,L5,L6,L7),L8 (MAJOR PORTION) AND PORTIONS OF (L9,L10,L11), LANGHAM PLACE, 8 ARGYLE STREET, MONG KOK, KOWLOON",,2018-03-08,0
PC,62,5062021552,Newport Theatre,"G/F (PORTION), 1/F (PORTION), 2/F (PORTION)AND 3/F (PORTION), 60-104 SOY STREET, MONG KOK, KOWLOON",,2018-04-13,0
PC,62,5062800027,CINE MOKO,"MINOR PORTION OF B1, GOODS YARD, MTR FLOOR, L1, L3 & L5, MAJOR PORTION OF L2 & L4, MOKO,193 PRINCE EDWARD ROAD WEST, MONG KOK, KOWLOON",,2018-09-03,0
PC,11,5011000014,SUNBEAM THEATRE,"G/F (PTN.) TO 4/F (PTN.), 423 KING'S ROAD, HONG KONG",,2017-10-23,0
PC,11,5011000032,MCL Kornhill Cinema,"4/F (PORTION), 5/F (PORTION) & 6/F (PORTION), KORNHILL PLAZA (SOUTH), 2 KORNHILL ROAD, HONG KONG",,2018-06-28,0
PC,11,5011800025,L CINEMA,"(PORTION OF G/F., M/F, 1/F) AND 2/F., GALAXY PLAZA, NO. 2 MONG LUNG STREET, SHAU KEI WAN, HONG KONG",,2018-08-01,0
PC,11,5711800031,Cinema City (Chai Wan),"G/F (PORTIONS), 1/F (PORTION), 2/F (PORTION), 3/F (PORTION) & 4/F (PORTION), WINNER CENTRE, 333 CHAI WAN ROAD, CHAI WAN, HONG KONG",,2018-01-12,0
PC,97,5097001004,"SIR RUN RUN SHAW HALL, THE CHINESE UNIVERSITY OF HONG KONG","SIR RUN RUN SHAW HALL,THE CHINESE UNIVERSITY OF HONG KONG, SHA TIN, NEW TERRITORIES",,2018-08-05,0
PC,97,5097001013,UA SHATIN CINEMA,"LEVEL 1, 2, LOWER & UPPER BASEMENT, CINEMA COMPLEX, NEW TOWN PLAZA, PHASE I, 18 SHATIN CENTRE STREET, SHA TIN, NEW TERRITORIES",,2018-06-30,0
PC,97,5097001022,MA ON SHAN CLASSICS CINEMA,"CINEMA 1, 2, 3, 4 G/F TO LEVEL 3(PORTION), LOT 307, SUNSHINE CITY PLAZA PHASE 4, MA ON SHAN, SHA TIN, NEW TERRITORIES",,2018-04-28,0
PC,97,5097001040,"MUSIC HALL, CHUNG CHI COLLEGE, THE CHINESE UNIVERSITY OF HONG KONG","LG/F (MUSIC HALL) & G/F (MUSIC HALL)TEACHING BUILDINGS OF CHUNG CHI COLLEGE, PHASE V,THE CHINESE UNIVERSITY OF HONG KONG, SHA TIN, NEW TERRITORIES",,2018-07-17,0
PC,61,5061000347,OCEAN THEATRE,"1/F (PORTION) - 5/F (PORTION), 3 CANTON ROAD, TSIM SHA TSUI, KOWLOON",,2018-06-20,0
PC,61,5061000505,"BROADWAY CINEMATHEQUE 1, 2, 3 & 4","CINEMA BLOCK, PHASE 2, PROSPEROUS GARDEN, KIL 10878, 3 PUBLIC SQUARE STREET, YAU MA TEI, KOWLOON",,2017-12-07,0
PC,61,5061800020,THE GRAND CINEMA,"GROUND LEVEL (PORTION), LEVEL 1 (PORTION), LEVEL 2 (PORTION), LEVEL 3 (PORTION) & PODIUM LEVEL (PORTION), ELEMENTS, KOWLOON STATION, 1 AUSTIN ROAD WEST, KOWLOON",,2018-03-19,0
PC,61,5061800039,UA ISQUARE,"7/F, 8/F, 9/F, M1 & M2, ISQUARE, NOS. 35-79 NATHAN ROAD, TSIMSHATSUI, LOT NO. K.I.L. 7425, KOWLOON",,2018-06-10,0
PC,61,5061800048,Broadway Cinema,"PORTION OF LEVEL 6, LEVEL 7, LEVEL 8, LEVEL 9,LEVEL 10, LEVEL 11, THE ONE, NO. 100 NATHAN ROAD, TSIM SHA TSUI, KOWLOON",,2018-03-16,0
PC,63,5063000040,Festival Grand,"PORTIONS OF LEVELS LG2, LG, G/F, UG,L1, L1A, L2 & L2A, FESTIVAL WALK, 80 TAT CHEE AVENUE, KOWLOON TONG, SHAM SHUI PO, KOWLOON",,2017-10-25,0
PC,12,5012000011,Hong Kong Arts Centre - Agnes b CINEMA,"LOWER & UPPER BASEMENT, HK ARTS CENTRE BUILDING, 2 HARBOUR ROAD, WAN CHAI, HONG KONG",,2017-10-10,0
PC,12,5012000020,HK Arts Centre - McAulay Studio,"LOWER & UPPER BASEMENT, HK ARTS CENTRE BUILDING, 2 HARBOUR ROAD, WAN CHAI, HONG KONG",,2017-10-10,0
PC,12,5012000039,Hong Kong Arts Centre - Shouson Theatre,"G/F - 2/F & 3/F (MAJOR PORTION), HK ARTS CENTRE BUILDING, 2 HARBOUR ROAD, HONG KONG",,2017-10-10,0
PC,12,5012000057,The HK Academy for Performing Arts-Theatre Bldg &The HK Jockey Club Amphitheatre,"THEATRE BUILDING &THE HONG KONG JOCKEY CLUB AMPHITHEATRE, THE HONG KONG ACADEMY FOR PERFORMING ARTS, 1 GLOUCESTER ROAD, WAN CHAI, HONG KONG",,2018-04-08,0
PC,12,5012000066,The Hong Kong Academy for Performing Arts - Exhibition Area,"EXHIBITION AREA, THE HONG KONG ACADEMY FOR PERFORMING ARTS, 1 GLOUCESTER ROAD, WAN CHAI, HONG KONG",,2018-04-14,0
PC,12,5012000084,HONG KONG CONVENTION & EXHIBITION CENTRE - THEATRE ONE,"THEATRE 1, HONG KONG CONVENTION & EXHIBITION CENTRE, 1 HARBOUR ROAD, WAN CHAI, HONG KONG",,2018-07-30,0
PC,12,5012000093,HONG KONG CONVENTION & EXHIBITION CENTRE - THEATRE TWO,"THEATRE 2, HONG KONG CONVENTION & EXHIBITION CENTRE, 1 HARBOUR ROAD, WAN CHAI, HONG KONG",,2018-07-30,0
PC,12,5012000136,Goethe - Institut Hong Kong Lecture Hall / Video Room,"14/F, HK ARTS CENTRE, 2 HARBOUR ROAD, WAN CHAI, HONG KONG",,2018-01-10,0
PC,12,5012000154,Cinema City,"22-36 PATERSON STREET, CAUSEWAY BAY, WAN CHAI, HONG KONG",,2018-07-19,0
PC,12,5012000163,President Theatre 1 & 2,"G/F(PORTION), 1/F(PORTION),  2/F(PORTION), 3/F(PORTION), 517 JAFFE ROAD, CAUSEWAY BAY, WAN CHAI, HONG KONG",,2018-05-14,0
PC,12,5012800022,Windsor Cinema,"4/F (PORTION), 5/F (PORTION), 6/F (PORTION),WINDSOR HOUSE, NO. 311 GLOUCESTER ROAD, CAUSEWAY BAY, HONG KONG",,2017-10-20,0
PC,12,5012800068,Cine Times,"PORTIONS OF 3/F TO 11/F, CINEMA PORTIONS OF 12/F TO 14/F, TIMES SQUARE, 1 MATHESON STREET, CAUSEWAY BAY, HONG KONG",,2017-11-12,0
PC,92,5092000015,Tsuen Wan Broadway Theatre,"PORTION OF L1, L2 AND L3, TSUEN WAN PLAZA, TAI PA STREET, TWTL 326, TSUEN WAN, NEW TERRITORIES",,2018-08-11,0
PC,92,5092000033,Disney's Storybook Theatre,"FL-413 (PORTION), FANTASYLAND, HONG KONG DISNEYLAND RESORT, LANTAU ISLAND, HONG KONG",,2018-07-31,0
PC,92,5092800044,GH CITYWALK,"1/F CINEMA & FOYER, 1/F, CITYWALK 2, 18 YEUNG UK ROAD, TSUEN WAN, NEW TERRITORIES",,2018-06-02,0
PC,91,5091000018,"Kwai Fong Broadway Theatre 1, 2, 3, 4, 5.","CINEMA NO.1, 2, 3, 4 & 5, L1-L4, METROPLAZA, 223 HING FONG ROAD, KCTL 395, KWAI CHUNG, NEW TERRITORIES",,2018-09-21,0
PC,91,5091000027,GH Tsing Yi Multiplex,"SHOP NO. G05, GROUND FLOOR(MAJOR PORTION) & MEZZANINE FLOOR, MARITIME SQUARE, 33 TSING KING ROAD, TSING YI, NEW TERRITORIES",,2018-02-28,0
PC,98,5098000017,MCL Metro City Cinema,"G/F., CINEMA AREA, METRO CITY, PHASE II, 8 YAN KING STREET, TSEUNG KWAN O, SAI KUNG, NEW TERRITORIES",,2017-11-06,0
PC,98,5098800028,THE STAR CINEMA,"THE STAR CINEMA, GROUND LEVEL (PORTION) , LEVEL 1 (PORTION) AND LEVEL 2 (PORTION), 9 TONG YIN STREET, TSEUNG KWAN O , SAI KUNG, NEW TERRITORIES",,2018-09-23,0
PC,51,5051000034,Cine-Art House-Amoy Plaza,"CINEMA BLOCK, PHASE III, AMOY PLAZA, 77 NGAU TAU KOK ROAD, KOWLOON BAY , KWUN TONG, KOWLOON",,2018-03-08,0
PC,51,5051000052,Palace APM,"PORTIONS OF (G/F, 1/F, 2/F, 3/F, 4/F,5/F), 6/F ( MAJOR PORTION) AND PORTIONS OF (U6/F, 7/F, 8/F), APM, MILLENNIUM CITY 5, 418 KWUN TONG ROAD , KWUN TONG, KOWLOON",,2018-04-27,0
PC,51,5051800063,UA MEGABOX,"UNIT 22 ON GROUND FLOOR, UNITS 1 TO 7 ON LEVEL 11,PORTIONS OF LEVEL 12 & LEVEL 13, MEGABOX , 38 WANG CHIU ROAD, KOWLOON BAY, R.P. OF N.K.I.L. 5927, KOWLOON",,2018-02-24,0
PC,51,5051800072,MCL TELFORD CINEMA,"LEVEL 2 (PORTION) & LEVEL 3, TELFORD GARDENS,NO.33 WAI YIP STREET, KOWLOON BAY,(NEW KOWLOON INLAND LOT NO. 5744), KOWLOON",,2018-02-03,0
PC,51,5051800081,EMAX,"PORTION OF G/F, KOWLOON BAY INTERNATIONAL TRADE AND  EXHIBITION CENTRE, 1 TRADEMART DRIVE, KOWLOON BAY, KWUN TONG, KOWLOON",,2018-07-21,0
PC,17,5017000025,Fantasyland Concert Hall,"FL-409 (PORTION), FANTASYLAND, HONG KONG DISNEYLAND RESORT, LANTAU ISLAND, HONG KONG",,2018-08-09,0
PC,17,5017000034,Theater in the Wild,"AL-508 (PORTION), ADVENTURELAND, HONG KONG DISNEYLAND RESORT, LANTAU ISLAND, HONG KONG",,2018-07-28,0
PC,17,5017800027,Ngong Ping Theme Village,"G/F., WALKING WITH BUDDHA, STAGE 360 & MOTION 360, NGONG PING VILLAGE, NGONG PING ROAD, LANTAU, HONG KONG",,2018-06-28,0
PC,17,5017800036,UA IMAX THEATRE@AIRPORT,"LEVEL 5 (PORTION), LEVEL 6 (PORTION) & LEVEL 7 (PORTION), TERMINAL 2, HONG KONG INTERNATIONAL AIRPORT, LANTAU ISLAND, HONG KONG",,2018-03-29,0
PC,53,5053000029,Broadway Hollywood Cinema,"G/F (MINOR PORTION), M/F (MINOR PORTION), LEVEL 1 (PORTION), LEVEL 2 (MINOR PORTION), LEVEL 3 (PORTION), LEVEL 4 (PORTION) & LEVEL 41.5 (PORTION),NKIL 6160, PLAZA HOLLYWOOD, 3 LUNG POON STREET, DIAMOND HILL, KOWLOON",,2018-06-26,0
PE,18,5118000014,Caritas-Hong Kong (St. Francis Settlement),"CARITAS-HONG KONG(ST. FRANCIS SETTLEMENT), CARITAS HOUSE, 2 CAINE ROAD, CENTRAL, HONG KONG",,2018-05-12,0
PE,18,5118000023,MADAME TUSSAUD'S EXHIBITION,"SHOP P101 ON P1, SHOP P201, P207 & P208 ON P2, MINOR PART ON P3 AND MAJOR PART ON P4, THE PEAK TOWER, 128 PEAK ROAD, THE PEAK, HONG KONG",,2018-07-28,0
PE,18,5118000032,No Record,"THE LANDMARK, G/F LEVEL & 2/F LEVEL (WEST BRIDGE), DES VOEUX ROAD CENTRAL, CENTRAL, HONG KONG",,2018-03-09,0
PE,18,5118000041,ST. JOHN'S CATHEDRAL,"FANNY LI HALL AND LI HALL, ST. JOHN’S CATHEDRAL, 4-8 GARDEN ROAD, CENTRAL, HONG KONG",,2018-07-11,0
PE,18,5118000069,UNIVERSITY OF HONG KONG-LOKE YEW HALL.,"THE UNIVERSITY OF HONG KONG-LOKE YEW HALL, BONHAM ROAD, WESTERN, HONG KONG",,2018-06-16,0
PE,18,5118800034,Asia Society Museum,"ASIA SOCIETY HONG KONG CENTRE, UPPER SITE, MAGAZINE A, JUSTICE DRIVE, ADMIRALTY, INLAND LOT NO. 9000, HONG KONG",,2018-08-13,0
PE,18,5118800043,Magnum Club,"3/F (PORTION), SILVER FORTUNE PLAZA, 1 WELLINGTON STREET, CENTRAL, HONG KONG",,2017-12-13,0
PE,18,5118800052,Hard Rock Café Hong Kong,"SHOP 1, LG/F., 55 D'AGUILAR STREET, CENTRAL, HONG KONG",,2018-01-17,0
PE,18,5118800061,HONG KONG MARITIME MUSEUM,"UPPER DECK LEVEL (PORTION), PODIUM DECK LEVEL (PORTION) AND ROOF DECK LEVEL (PORTION), THE CENTRAL FERRY PIER NO. 8, CENTRAL, HONG KONG",,2018-02-21,0
PE,52,5152000014,CARITAS HONG KONG,"3/F & 5/F (BALCONY), 256A PRINCE EDWARD ROAD, KOWLOON CITY, KOWLOON",,2018-07-15,0
PE,52,5152000032,Jumpin  Gym U.S.A.,"PORTION OF 2ND BASEMENT, TREASURE WORLD, SITE 11, WHAMPOA GARDEN, HUNG HOM, KOWLOON",,2018-01-14,0
PE,52,5152000096,Jumpin  Gym U.S.A.,"PORTION OF SHOP B110-B111, B1/F,KCP, 128 CARPENTER ROAD, KOWLOON CITY, KOWLOON",,2018-07-10,0
PE,52,5152000102,Cute City,"SHOP 225, HOMANTIN PLAZA, HOMANTIN ESTATE, KOWLOON CITY, KOWLOON",,2018-03-26,0
PE,52,5152000120,ACADEMIC COMMUNITY HALL H. K. BAPTIST UNIVERSITY,"224 WATERLOO ROAD, KOWLOON CITY, KOWLOON",,2018-05-15,0
PE,52,5152800025,Jumpin  Gym U.S.A.,"SHOP NOS. 123, 124 & 124A, FIRST FLOOR, GRAND WATERFRONT PLAZA, 38 SAN MA TAU STREET, MA TAU KOK, KOWLOON",,2017-12-09,0
PE,52,5152800034,Jumpin  Gym U.S.A.,"SHOP NO. 12, GROUND FLOOR, JUBILANT PLACE SHOPPING ARCADE, 33 MA TAU KOK ROAD, TOKWAWAN, KOWLOON",,2018-01-30,0
PE,52,5152800070,VERY HAPPY,"SHOP 104A, 104B, 104C, 107C, 107D AND 107E, 1/F,HORAE PLAZA, NO. 209 MA TAU WAI ROAD,TO KWA WAN, KOWLOON",,2018-12-15,0
PE,52,5152800089,HONG KONG BAPTIST UNIVERSITY,"PORTION OF LEVEL 1 AND ROOM 201 ON LEVEL 2, ACADEMIC AND ADMINISTRATION BUILDING, 15 BAPTIST UNIVERSITY ROAD, KOWLOON TONG, N.K.I.L. 6173, KOWLOON",,2018-06-03,0
PE,52,5152800098,Cute City,"SHOP NO. F14, FIRST FLOOR, OI MAN PLAZA, UPPER OI MAN ESTATE, 60 CHUNG HAU STREET, KOWLOON",,2018-05-06,0
PE,94,5194000010,Yuen Long Town Hall,"YUEN LONG TOWN HALL, TAI YUK ROAD, YUEN LONG, NEW TERRITORIES",,2018-09-27,0
PE,94,5194800030,Molly Fantasy,"UNIT 1, SHOP NO. 222A, 2/F, PHASE 1, FORTUNE KINGSWOOD , 12-18 TIN YAN ROAD, TIN SHUI WAI , YUEN LONG, NEW TERRITORIES",,2018-06-01,0
PE,94,5194800085,CUTIE SHOP,"SHOP 4, G/F, FUK TAK BUILDING, 234-242 CASTLE PEAK ROAD, YUEN LONG, NEW TERRITORIES",,2018-02-26,0
PE,94,5194800094,The Green Atrium,"2/F (PORTION A), SITE C, 68 KUNG UM ROAD, YUEN LONG, NEW TERRITORIES",,2017-11-17,0
PE,94,5194800100,Jumpin  Gym U.S.A.,"SHOP NO. L126, FIRST FLOOR, TIN SHING SHOPPING CENTRE, TIN SHING COURT, 3 TIN CHING STREET, TIN SHUI WAI, YUEN LONG, NEW TERRITORIES",,2018-05-23,0
PE,94,5194800119,Jumpin  Gym U.S.A.,"SHOP NOS. M010, M011, M012, M013 AND M014, MEZZANINE FLOOR, KANG PING HOUSE BLOCK 5, (FORMING PART OF AREAS/FACILITIES), LONG PING ESTATE, YUEN LONG, NEW TERRITORIES",,2018-01-10,0
PE,96,5196800025,Jumpin  Gym U.S.A.,"PORTION OF SHOP NO. 31A & 31B, LEVEL 2, SHEUNG SHUI TOWN CENTRE, SHEUNG SHUI, NEW TERRITORIES",,2018-09-20,0
PE,96,5196800052,Namco Wonder Park,"SHOP NOS. 29 AND 29A, UG/F, AVON PARK, 15 YAT MING ROAD, FANLING, NEW TERRITORIES",,2018-10-16,0
PE,96,5196800070,Jumpin Gym U.S.A. Limited,"SHOP NOS. 158A AND 158-166, G/F, FANLING CENTRE, 33 SAN WAN ROAD, FANLING, NEW TERRITORIES",,2018-08-12,0
PE,96,5196800098,Dream Star,"SHOP NO. 26, 3/F, CHOI YUEN PLAZA, CHOI YUEN ESTATE, SHEUNG SHUI, NEW TERRITORIES",,2018-06-17,0
PE,96,5196800104,Rainbow Land,"SHOP R117, R118, 1/F, WAH SUM SHOPPING CENTRE, WAH SUM ESTATE, 18 YAT MING ROAD, FANLING, NEW TERRITORIES",,2018-05-12,0
PE,15,5115000022,Jumpin  Gym U.S.A.,"PORTION OF SHOP NO.1, 2/F, SITE 2, ABERDEEN CENTRE, 7-11 NAM NING STREET, ABERDEEN, SOUTHERN, HONG KONG",,2018-08-30,0
PE,15,5115000059,"Assembly Hall, Aberdeen Kai-fong Welfare Assn. Social Services Centre","G/F, 180B ABERDEEN MAIN ROAD, ABERDEEN, SOUTHERN, HONG KONG",,2018-05-04,0
PE,15,5115000068,Hong Kong International School - Tai Tam,"1 RED HILL ROAD, TAI TAM, SOUTHERN, HONG KONG",,2018-05-30,0
PE,15,5115000077,Ocean Park,"OCEAN PARK (EXCLUDES PORTION OF OCEAN PARK SQUARE), WONG CHUK HANG ROAD, BRICK HILL, ABERDEEN, SOUTHERN, HONG KONG",,2018-01-26,0
PE,95,5195800028,MEGA FUN,"SHOP 107, G/F, COMMERCIAL BLOCK B, TAI YUEN SHOPPING CENTRE, TAI YUEN ESTATE, 10 TING KOK ROAD, TAI PO, NEW TERRITORIES",,2017-12-02,0
PE,93,5193000059,The Hong Kong Jockey Club,"PORTIONS OF LEVEL 1-3,TMTL 277, TUEN MUN CENTRE, CASTLE PEAK ROAD, TUEN MUN, NEW TERRITORIES",,2018-01-11,0
PE,93,5193000068,Jumpin  Gym U.S.A.,"SHOP NOS. 301 & 302A, LEVEL 3, CHELSEA HEIGHTS, NO.1 SHEK PAI TAU PATH, TUEN MUN, NEW TERRITORIES",,2017-11-04,0
PE,93,5193800042,Dream-Land,"SHOP NOS. 4-5, 1/F, OCEAN WALK, 168-236 WU CHUI ROAD, TUEN MUN, NEW TERRITORIES",,2018-09-20,0
PE,93,5193800051,Jumpin  Gym U.S.A.,"SHOP NOS. L321-L324, LEVEL 3, BUTTERFLY PLAZA, 1 WU CHUI ROAD, TUEN MUN, NEW TERRITORIES",,2018-09-26,0
PE,93,5193800060,Jumpin  Gym U.S.A.,"SHOP NOS. L326, L327, L328 AND PORTION OF COMMON AREA, LEVEL 3, LEUNG KING PLAZA, LEUNG KING ESTATE, NO. 31 TIN KING ROAD, TUEN MUN, NEW TERRITORIES",,2018-01-13,0
PE,93,5193800079,Jumpin  Gym U.S.A.,"PORTION OF SHOP NO. S-220, S-221 AND S-222 AND THE EXTENDED AREA, LEVEL 2, ZONE S, H.A.N.D.S, YAU OI ESTATE, YAU OI ROAD, TUEN MUN, NEW TERRITORIES",,2018-07-30,0
PE,93,5193800088,Game Art,"SHOP UNIT 60-61 & 68-69, LEVEL 2, SUN TUEN MUN CENTRE, 55-65 LUNG MUN ROAD, TUEN MUN, NEW TERRITORIES",,2018-01-24,0
PE,62,5162800028,Namco Wonder Park,"SHOP NOS. 03 & 05 - 11 ON LEVEL 9, LANGHAM PLACE, 8 ARGYLE STREET, KOWLOON",,2018-02-14,0
PE,62,5162800073,MacPherson Stadium,"B/F (PORTION), G/F (PORTIONS),UG/F (PORTIONS), 1/F (PORTIONS), U1/F (PORTIONS),2/F (PORTION) & 3/F (PORTION), 38 NELSON STREET, MONG KOK, KOWLOON",,2017-12-22,0
PE,62,5162800091,Jumpin  Gym U.S.A.,"SHOP NO.115 ON FIRST FLOOR, OLYMPIAN CITY ONE, KOWLOON INLAND LOT NO.11074, KOWLOON",,2018-02-19,0
PE,11,5111000079,Jumpin  Gym U.S.A.,"PORTION OF SHOP 103B, 1/F., CITYPLAZA , 18 TAIKOO SHING ROAD, TAIKOO SHING, ISLAND EAST, HONG KONG",,2018-09-25,0
PE,11,5111000112,NORTH POINT KAIFONG WELFARE ADVANCEMENT ASSOCIATION-DR. SEAKER CHAN SHUI KUI HALL,"I. L. 8081 JAVA ROAD & MARBLE ROAD, EASTERN, HONG KONG",,2018-06-04,0
